# name: test/sql/maintenance/index_coexistence.test
# description: The index next to other DuckDB features: a second PDXearch index on another column, a unique ART index,
#              an UPDATE of a column no index uses, the VACUUM statement, and an index in another schema.
# group: [maintenance]

require parquet

require pdxearch

# A database with small row groups keeps the multi-row-group layouts cheap; no automatic checkpoint may merge
# row groups halfway through the test.
statement ok
ATTACH '__TEST_DIR__/coex.db' AS coex (ROW_GROUP_SIZE 8192);

statement ok
USE coex;

statement ok
SET late_materialization_max_rows = 0;

statement ok
SET checkpoint_threshold = '10GB';

# Variables
test-env DIMS 128

test-env LIMIT 10

test-env QUERY_EMB [0,16,35,5,32,31,14,10,11,78,55,10,45,83,11,6,14,57,102,75,20,8,3,5,67,17,19,26,5,0,1,22,60,26,7,1,18,22,84,53,85,119,119,4,24,18,7,7,1,81,106,102,72,30,6,0,9,1,9,119,72,1,4,33,119,29,6,1,0,1,14,52,119,30,3,0,0,55,92,111,2,5,4,9,22,89,96,14,1,0,1,82,59,16,20,5,25,14,11,4,0,0,1,26,47,23,4,0,0,4,38,83,30,14,9,4,9,17,23,41,0,0,2,8,19,25,23,1]

test-env MARKER_A [200,200,200,200,200,200,200,200,200,200,200,200,200,200,200,200,200,200,200,200,200,200,200,200,200,200,200,200,200,200,200,200,200,200,200,200,200,200,200,200,200,200,200,200,200,200,200,200,200,200,200,200,200,200,200,200,200,200,200,200,200,200,200,200,200,200,200,200,200,200,200,200,200,200,200,200,200,200,200,200,200,200,200,200,200,200,200,200,200,200,200,200,200,200,200,200,200,200,200,200,200,200,200,200,200,200,200,200,200,200,200,200,200,200,200,200,200,200,200,200,200,200,200,200,200,200,200,200]

test-env MARKER_B [1,1,1,1,1,1,1,1,1,1,1,1,1,1,1,1,1,1,1,1,1,1,1,1,1,1,1,1,1,1,1,1,1,1,1,1,1,1,1,1,1,1,1,1,1,1,1,1,1,1,1,1,1,1,1,1,1,1,1,1,1,1,1,1,1,1,1,1,1,1,1,1,1,1,1,1,1,1,1,1,1,1,1,1,1,1,1,1,1,1,1,1,1,1,1,1,1,1,1,1,1,1,1,1,1,1,1,1,1,1,1,1,1,1,1,1,1,1,1,1,1,1,1,1,1,1,1,1]

statement ok
CREATE TABLE sift AS SELECT id, emb::FLOAT[${DIMS}] AS emb FROM read_parquet('test/assets/sift-128-euclidean-245760.parquet') WHERE id < 32768;

foreach quantization f32

# Two PDXearch indexes on two embedding columns, both maintained by the same commits.
statement ok
CREATE OR REPLACE TABLE t1 AS SELECT id, emb, emb AS emb2, id % 7 AS extra FROM sift WHERE id < 8192;

statement ok
CREATE INDEX t1_idx ON t1 USING PDXEARCH (emb) WITH (metric = 'l2sq', quantization = '${quantization}', n_probe = 0, seed = 0);

statement ok
CREATE INDEX t1_idx2 ON t1 USING PDXEARCH (emb2) WITH (metric = 'l2sq', quantization = '${quantization}', n_probe = 0, seed = 0);

statement ok
INSERT INTO t1 VALUES (-1, ${MARKER_A}::FLOAT[${DIMS}], ${MARKER_A}::FLOAT[${DIMS}], 0);

query I
SELECT id FROM t1 ORDER BY array_distance(emb, ${MARKER_A}::FLOAT[${DIMS}]) LIMIT 1;
----
-1

query I
SELECT id FROM t1 ORDER BY array_distance(emb2, ${MARKER_A}::FLOAT[${DIMS}]) LIMIT 1;
----
-1

query II
CALL pdxearch_sync_index('t1_idx');
----
t1_idx	false

query II
CALL pdxearch_sync_index('t1_idx2');
----
t1_idx2	false

statement ok
DELETE FROM t1 WHERE id = -1;

query I
SELECT id <> -1 FROM t1 ORDER BY array_distance(emb, ${MARKER_A}::FLOAT[${DIMS}]) LIMIT 1;
----
true

query I
SELECT id <> -1 FROM t1 ORDER BY array_distance(emb2, ${MARKER_A}::FLOAT[${DIMS}]) LIMIT 1;
----
true

# A unique ART index next to them: its constraint is checked before anything is committed, so a rejected row is never
# staged.
statement ok
CREATE UNIQUE INDEX t1_uid ON t1 (id);

statement ok
INSERT INTO t1 VALUES (-2, ${MARKER_B}::FLOAT[${DIMS}], ${MARKER_B}::FLOAT[${DIMS}], 0);

statement error
INSERT INTO t1 VALUES (-2, ${MARKER_A}::FLOAT[${DIMS}], ${MARKER_A}::FLOAT[${DIMS}], 0);
----
<REGEX>:.*[Dd]uplicate.*

query I
SELECT id FROM t1 ORDER BY array_distance(emb, ${MARKER_B}::FLOAT[${DIMS}]) LIMIT 1;
----
-2

query I
SELECT id <> -2 FROM t1 ORDER BY array_distance(emb, ${MARKER_A}::FLOAT[${DIMS}]) LIMIT 1;
----
true

query II
CALL pdxearch_sync_index('t1_idx');
----
t1_idx	false

# An UPDATE of a column no index uses.
statement ok
UPDATE t1 SET extra = 42 WHERE id >= 0 AND id < 100;

query I
SELECT COUNT(*) FROM t1 WHERE extra = 42;
----
100

query I
SELECT id FROM t1 ORDER BY array_distance(emb, ${MARKER_B}::FLOAT[${DIMS}]) LIMIT 1;
----
-2

statement ok
CREATE OR REPLACE TABLE t_copy AS FROM t1;

statement ok
CREATE OR REPLACE TABLE t_gt AS SELECT id FROM t_copy ORDER BY array_distance(emb, ${QUERY_EMB}::FLOAT[${DIMS}]) LIMIT ${LIMIT};

statement ok
CREATE OR REPLACE TABLE t_idx_res AS SELECT id FROM t1 ORDER BY array_distance(emb, ${QUERY_EMB}::FLOAT[${DIMS}]) LIMIT ${LIMIT};

query I
SELECT COUNT(*) >= ${LIMIT} - 1 FROM t_gt JOIN t_idx_res USING (id);
----
true

# The VACUUM statement, the one path that reaches the index's Vacuum hook.
statement ok
VACUUM;

statement ok
VACUUM ANALYZE t1;

statement ok
INSERT INTO t1 VALUES (-4, ${MARKER_A}::FLOAT[${DIMS}], ${MARKER_A}::FLOAT[${DIMS}], 0);

query I
SELECT id FROM t1 ORDER BY array_distance(emb, ${MARKER_A}::FLOAT[${DIMS}]) LIMIT 1;
----
-4

query I
SELECT id FROM t1 ORDER BY array_distance(emb2, ${MARKER_A}::FLOAT[${DIMS}]) LIMIT 1;
----
-4

statement ok
DROP INDEX t1_uid;

statement ok
DROP INDEX t1_idx;

statement ok
DROP INDEX t1_idx2;

# An index on a table in another schema is found by CALL pdxearch_sync_index.
statement ok
CREATE SCHEMA IF NOT EXISTS other;

statement ok
CREATE OR REPLACE TABLE other.t2 AS SELECT id, emb FROM sift WHERE id < 8192;

statement ok
CREATE INDEX t2_idx ON other.t2 USING PDXEARCH (emb) WITH (metric = 'l2sq', quantization = '${quantization}', n_probe = 0, seed = 0);

statement ok
INSERT INTO other.t2 VALUES (-1, ${MARKER_A}::FLOAT[${DIMS}]);

query II
CALL pdxearch_sync_index('t2_idx');
----
t2_idx	true

query II
CALL pdxearch_sync_index('t2_idx');
----
t2_idx	false

query I
SELECT id FROM other.t2 ORDER BY array_distance(emb, ${MARKER_A}::FLOAT[${DIMS}]) LIMIT 1;
----
-1

statement ok
DROP INDEX other.t2_idx;

endloop
