# name: test/sql/maintenance/index_delete_update.test
# description: DELETEs remove rows from the index at commit; an UPDATE of the embedding column is a delete plus an insert
#              (the row gets a new row id and is indexed by the next search).
# group: [maintenance]

require parquet

require pdxearch

# A database with small row groups keeps the multi-row-group layouts cheap; no automatic checkpoint may merge
# row groups halfway through the test.
statement ok
ATTACH '__TEST_DIR__/del.db' AS del (ROW_GROUP_SIZE 8192);

statement ok
USE del;

statement ok
SET late_materialization_max_rows = 0;

statement ok
SET checkpoint_threshold = '10GB';

# Variables
test-env DIMS 128

test-env LIMIT 10

test-env QUERY_EMB [0,16,35,5,32,31,14,10,11,78,55,10,45,83,11,6,14,57,102,75,20,8,3,5,67,17,19,26,5,0,1,22,60,26,7,1,18,22,84,53,85,119,119,4,24,18,7,7,1,81,106,102,72,30,6,0,9,1,9,119,72,1,4,33,119,29,6,1,0,1,14,52,119,30,3,0,0,55,92,111,2,5,4,9,22,89,96,14,1,0,1,82,59,16,20,5,25,14,11,4,0,0,1,26,47,23,4,0,0,4,38,83,30,14,9,4,9,17,23,41,0,0,2,8,19,25,23,1]

test-env MARKER_A [200,200,200,200,200,200,200,200,200,200,200,200,200,200,200,200,200,200,200,200,200,200,200,200,200,200,200,200,200,200,200,200,200,200,200,200,200,200,200,200,200,200,200,200,200,200,200,200,200,200,200,200,200,200,200,200,200,200,200,200,200,200,200,200,200,200,200,200,200,200,200,200,200,200,200,200,200,200,200,200,200,200,200,200,200,200,200,200,200,200,200,200,200,200,200,200,200,200,200,200,200,200,200,200,200,200,200,200,200,200,200,200,200,200,200,200,200,200,200,200,200,200,200,200,200,200,200,200]

statement ok
CREATE TABLE sift AS SELECT id, emb::FLOAT[${DIMS}] AS emb FROM read_parquet('test/assets/sift-128-euclidean-245760.parquet') WHERE id < 32768;

foreach quantization f32

statement ok
CREATE OR REPLACE TABLE t1 AS SELECT * FROM sift WHERE id < 20000 UNION ALL SELECT -1, ${MARKER_A}::FLOAT[${DIMS}];

statement ok
CREATE INDEX t1_idx ON t1 USING PDXEARCH (emb) WITH (metric = 'l2sq', quantization = '${quantization}', n_probe = 0, seed = 0);

query I
SELECT id FROM t1 ORDER BY array_distance(emb, ${MARKER_A}::FLOAT[${DIMS}]) LIMIT 1;
----
-1

statement ok
DELETE FROM t1 WHERE id = -1;

query I
SELECT id <> -1 FROM t1 ORDER BY array_distance(emb, ${MARKER_A}::FLOAT[${DIMS}]) LIMIT 1;
----
true

statement ok
DELETE FROM t1 WHERE id % 2 = 0;

statement ok
CREATE OR REPLACE TABLE t_idx_res AS SELECT id FROM t1 ORDER BY array_distance(emb, ${QUERY_EMB}::FLOAT[${DIMS}]) LIMIT 50;

query I
SELECT COUNT(*) FROM t_idx_res WHERE id % 2 = 0;
----
0

query I
SELECT COUNT(*) FROM t_idx_res;
----
50

statement ok
CREATE OR REPLACE TABLE t_copy AS FROM t1;

statement ok
CREATE OR REPLACE TABLE t_gt AS SELECT id FROM t_copy WHERE emb IS NOT NULL ORDER BY array_distance(emb, ${QUERY_EMB}::FLOAT[${DIMS}]) LIMIT ${LIMIT};

statement ok
CREATE OR REPLACE TABLE t_idx_res AS SELECT id FROM t1 ORDER BY array_distance(emb, ${QUERY_EMB}::FLOAT[${DIMS}]) LIMIT ${LIMIT};

query I
SELECT COUNT(*) >= ${LIMIT} - 1 FROM t_gt JOIN t_idx_res USING (id);
----
true

# UPDATE of the embedding: the row moves to a new row id and its old embedding is gone.
statement ok
UPDATE t1 SET emb = ${MARKER_A}::FLOAT[${DIMS}] WHERE id = 7;

query I
SELECT id FROM t1 ORDER BY array_distance(emb, ${MARKER_A}::FLOAT[${DIMS}]) LIMIT 1;
----
7

query I
SELECT COUNT(*) FROM (SELECT id FROM t1 ORDER BY array_distance(emb, ${MARKER_A}::FLOAT[${DIMS}]) LIMIT 50) WHERE id = 7;
----
1

# UPDATE to NULL removes the row from the index.
statement ok
UPDATE t1 SET emb = NULL WHERE id = 7;

query I
SELECT id <> 7 FROM t1 ORDER BY array_distance(emb, ${MARKER_A}::FLOAT[${DIMS}]) LIMIT 1;
----
true

statement ok
DROP INDEX t1_idx;

endloop
