# name: test/sql/maintenance/index_concurrent_maintenance.test
# description: Connections inserting, searching and deleting at the same time: every search triggers a sync under the
#              exclusive lock while other searches hold the shared one, and nothing is lost or duplicated.
# group: [maintenance]

require parquet

require pdxearch

# A database with small row groups keeps the multi-row-group layouts cheap; no automatic checkpoint may merge
# row groups halfway through the test.
statement ok
ATTACH '__TEST_DIR__/conc.db' AS conc (ROW_GROUP_SIZE 8192);

statement ok
USE conc;

statement ok
SET late_materialization_max_rows = 0;

statement ok
SET checkpoint_threshold = '10GB';

# Variables
test-env DIMS 128

test-env LIMIT 10

test-env QUERY_EMB [0,16,35,5,32,31,14,10,11,78,55,10,45,83,11,6,14,57,102,75,20,8,3,5,67,17,19,26,5,0,1,22,60,26,7,1,18,22,84,53,85,119,119,4,24,18,7,7,1,81,106,102,72,30,6,0,9,1,9,119,72,1,4,33,119,29,6,1,0,1,14,52,119,30,3,0,0,55,92,111,2,5,4,9,22,89,96,14,1,0,1,82,59,16,20,5,25,14,11,4,0,0,1,26,47,23,4,0,0,4,38,83,30,14,9,4,9,17,23,41,0,0,2,8,19,25,23,1]

statement ok
CREATE TABLE sift AS SELECT id, emb::FLOAT[${DIMS}] AS emb FROM read_parquet('test/assets/sift-128-euclidean-245760.parquet') WHERE id < 32768;

foreach quantization f32

statement ok
CREATE OR REPLACE TABLE t1 AS SELECT * FROM sift WHERE id < 8192;

statement ok
CREATE INDEX t1_idx ON t1 USING PDXEARCH (emb) WITH (metric = 'l2sq', quantization = '${quantization}', n_probe = 0, seed = 0);

# Eight connections, each committing 100 rows, searching, deleting one of its rows, and searching again.
concurrentloop threadid 0 8

statement ok
USE conc;

statement ok
SET late_materialization_max_rows = 0;

statement ok
INSERT INTO t1 SELECT * FROM sift WHERE id >= 8192 + 100 * ${threadid} AND id < 8192 + 100 * (${threadid} + 1);

query I
SELECT COUNT(*) FROM (SELECT id FROM t1 ORDER BY array_distance(emb, ${QUERY_EMB}::FLOAT[${DIMS}]) LIMIT 5);
----
5

statement ok
DELETE FROM t1 WHERE id = 8192 + 100 * ${threadid};

query I
SELECT COUNT(*) FROM (SELECT id FROM t1 ORDER BY array_distance(emb, ${QUERY_EMB}::FLOAT[${DIMS}]) LIMIT 5);
----
5

endloop

query I
SELECT COUNT(*) FROM t1;
----
8984

# Everything committed is indexed exactly once.
query II
CALL pdxearch_sync_index('t1_idx');
----
t1_idx	false

statement ok
CREATE OR REPLACE TABLE t_copy AS FROM t1;

statement ok
CREATE OR REPLACE TABLE t_gt AS SELECT id FROM t_copy ORDER BY array_distance(emb, ${QUERY_EMB}::FLOAT[${DIMS}]) LIMIT ${LIMIT};

statement ok
CREATE OR REPLACE TABLE t_idx_res AS SELECT id FROM t1 ORDER BY array_distance(emb, ${QUERY_EMB}::FLOAT[${DIMS}]) LIMIT ${LIMIT};

query I
SELECT COUNT(*) >= ${LIMIT} - 1 FROM t_gt JOIN t_idx_res USING (id);
----
true

query II
SELECT COUNT(*), COUNT(DISTINCT id) FROM (SELECT id FROM t1 WHERE id >= 8192 ORDER BY array_distance(emb, ${QUERY_EMB}::FLOAT[${DIMS}]) LIMIT 50);
----
50	50

statement ok
DROP INDEX t1_idx;

endloop
