# name: test/sql/maintenance/index_transactions_isolation.test
# description: Two connections: a search under an old snapshot syncs rows committed after the snapshot but never returns
#              them; a transaction's own uncommitted inserts are not in the index yet, and its own uncommitted deletes
#              are dropped when the results are materialized.
# group: [maintenance]

require parquet

require pdxearch

# A database with small row groups keeps the multi-row-group layouts cheap; no automatic checkpoint may merge
# row groups halfway through the test.
statement ok
ATTACH '__TEST_DIR__/iso.db' AS iso (ROW_GROUP_SIZE 8192);

statement ok
USE iso;

statement ok
SET late_materialization_max_rows = 0;

statement ok
SET checkpoint_threshold = '10GB';

# Variables
test-env DIMS 128

test-env MARKER_A [200,200,200,200,200,200,200,200,200,200,200,200,200,200,200,200,200,200,200,200,200,200,200,200,200,200,200,200,200,200,200,200,200,200,200,200,200,200,200,200,200,200,200,200,200,200,200,200,200,200,200,200,200,200,200,200,200,200,200,200,200,200,200,200,200,200,200,200,200,200,200,200,200,200,200,200,200,200,200,200,200,200,200,200,200,200,200,200,200,200,200,200,200,200,200,200,200,200,200,200,200,200,200,200,200,200,200,200,200,200,200,200,200,200,200,200,200,200,200,200,200,200,200,200,200,200,200,200]

test-env MARKER_B [1,1,1,1,1,1,1,1,1,1,1,1,1,1,1,1,1,1,1,1,1,1,1,1,1,1,1,1,1,1,1,1,1,1,1,1,1,1,1,1,1,1,1,1,1,1,1,1,1,1,1,1,1,1,1,1,1,1,1,1,1,1,1,1,1,1,1,1,1,1,1,1,1,1,1,1,1,1,1,1,1,1,1,1,1,1,1,1,1,1,1,1,1,1,1,1,1,1,1,1,1,1,1,1,1,1,1,1,1,1,1,1,1,1,1,1,1,1,1,1,1,1,1,1,1,1,1,1]

statement ok
CREATE TABLE sift AS SELECT id, emb::FLOAT[${DIMS}] AS emb FROM read_parquet('test/assets/sift-128-euclidean-245760.parquet') WHERE id < 32768;

statement ok con1
USE iso;

statement ok con1
SET late_materialization_max_rows = 0;

statement ok con2
USE iso;

statement ok con2
SET late_materialization_max_rows = 0;

foreach quantization f32

statement ok
CREATE OR REPLACE TABLE t1 AS SELECT * FROM sift WHERE id < 8192;

statement ok
CREATE INDEX t1_idx ON t1 USING PDXEARCH (emb) WITH (metric = 'l2sq', quantization = '${quantization}', n_probe = 0, seed = 0);

# con1 takes its snapshot, then con2 commits a row.
statement ok con1
BEGIN;

query I con1
SELECT COUNT(*) FROM t1;
----
8192

statement ok con2
INSERT INTO t1 VALUES (-1, ${MARKER_A}::FLOAT[${DIMS}]);

# con1's search syncs the committed row into the index but cannot see it: the candidate is dropped when the results
# are materialized, so the search returns one row less than asked.
query II con1
SELECT COUNT(*) FILTER (WHERE id = -1), COUNT(*) FROM (SELECT id FROM t1 ORDER BY array_distance(emb, ${MARKER_A}::FLOAT[${DIMS}]) LIMIT 5);
----
0	4

query I con1
SELECT COUNT(*) FROM t1;
----
8192

# The row is indexed nonetheless: nothing is left to sync.
query II con2
CALL pdxearch_sync_index('t1_idx');
----
t1_idx	false

statement ok con1
COMMIT;

query I con1
SELECT id FROM t1 ORDER BY array_distance(emb, ${MARKER_A}::FLOAT[${DIMS}]) LIMIT 1;
----
-1

# A transaction's own uncommitted insert is not in the index until it commits.
statement ok con1
BEGIN;

statement ok con1
INSERT INTO t1 VALUES (-2, ${MARKER_B}::FLOAT[${DIMS}]);

query I con1
SELECT id <> -2 FROM t1 ORDER BY array_distance(emb, ${MARKER_B}::FLOAT[${DIMS}]) LIMIT 1;
----
true

statement ok con1
COMMIT;

query I con1
SELECT id FROM t1 ORDER BY array_distance(emb, ${MARKER_B}::FLOAT[${DIMS}]) LIMIT 1;
----
-2

# A transaction's own uncommitted delete: the row stays in the index until COMMIT, but the transaction cannot see it,
# so the candidate is dropped.
statement ok con1
BEGIN;

statement ok con1
DELETE FROM t1 WHERE id = -2;

query I con1
SELECT COUNT(*) FROM (SELECT id FROM t1 ORDER BY array_distance(emb, ${MARKER_B}::FLOAT[${DIMS}]) LIMIT 1);
----
0

query I con2
SELECT id FROM t1 ORDER BY array_distance(emb, ${MARKER_B}::FLOAT[${DIMS}]) LIMIT 1;
----
-2

statement ok con1
ROLLBACK;

query I con1
SELECT id FROM t1 ORDER BY array_distance(emb, ${MARKER_B}::FLOAT[${DIMS}]) LIMIT 1;
----
-2

statement ok
DROP INDEX t1_idx;

endloop
